{
  "$schema": "https://json-schema.org/draft/2020-12/schema",
  "title": "Battlecode bounded worker result v1",
  "type": "object",
  "additionalProperties": false,
  "required": ["protocol_version", "task_id", "bot_id", "base_source_hash", "outcome", "hypothesis", "changed_paths", "evidence", "tests", "blocked_reason", "next_action"],
  "properties": {
    "protocol_version": {"type": "integer", "enum": [1]},
    "task_id": {"type": "string", "minLength": 1},
    "bot_id": {"type": "string", "pattern": "^[a-z0-9][a-z0-9-]{2,63}$"},
    "base_source_hash": {"type": "string", "pattern": "^[a-f0-9]{64}$"},
    "outcome": {"type": "string", "enum": ["READY_FOR_EVAL", "NO_CHANGE", "BLOCKED"]},
    "hypothesis": {"type": "string"},
    "changed_paths": {"type": "array", "items": {"type": "string"}},
    "evidence": {
      "type": "array",
      "items": {
        "type": "object",
        "additionalProperties": false,
        "required": ["kind", "reference", "claim"],
        "properties": {
          "kind": {"type": "string", "enum": ["match", "evaluation", "source", "check", "rules"]},
          "reference": {"type": "string"},
          "claim": {"type": "string"}
        }
      }
    },
    "tests": {
      "type": "array",
      "items": {
        "type": "object",
        "additionalProperties": false,
        "required": ["command", "status", "exit_code", "report_path"],
        "properties": {
          "command": {"type": "string"},
          "status": {"type": "string", "enum": ["PASSED", "FAILED", "NOT_RUN"]},
          "exit_code": {"type": ["integer", "null"]},
          "report_path": {"type": ["string", "null"]}
        }
      }
    },
    "blocked_reason": {"type": ["string", "null"]},
    "next_action": {"type": "string"}
  }
}
